[
  { "slug": "men-tao", "name": "门套", "aliases": ["门框套", "哑口套"], "short_def": "包覆门洞的框架饰面，保护墙角并固定门扇；材质与包边方式直接影响耐用度和观感。", "source": "seed", "confidence": 1 },
  { "slug": "qiang-dian", "name": "强电", "aliases": ["强电电线", "电力线路"], "short_def": "220V 供电线路（照明、插座、空调等），电线品牌与线径关系用电安全，属隐蔽工程。", "source": "seed", "confidence": 1 },
  { "slug": "ruo-dian", "name": "弱电", "aliases": ["弱电电线", "网线电视线"], "short_def": "低电压信号线路（网络、电视、电话、监控），装修时与强电分管敷设避免干扰。", "source": "seed", "confidence": 1 },
  { "slug": "ji-jia-mian-ji", "name": "计价面积", "aliases": ["报价面积", "套内计价面积"], "short_def": "装修公司据以计算套餐价的面积，通常按套内实测，≠ 房产商售卖面积（建筑面积）。", "source": "seed", "confidence": 1 },
  { "slug": "shou-mai-mian-ji", "name": "售卖面积", "aliases": ["建筑面积"], "short_def": "购房合同上的建筑面积，含公摊；装修报价一般不按此计，需换算成计价面积。", "source": "seed", "confidence": 1 },
  { "slug": "ying-zhuang", "name": "硬装", "aliases": ["基础装修", "硬装修"], "short_def": "固定在建筑上不可移动的装修部分：水电、防水、瓦工、木作基层、墙面、门窗等。", "source": "seed", "confidence": 1 },
  { "slug": "quan-an", "name": "全案", "aliases": ["全案基础价", "整装全案"], "short_def": "硬装+定制柜（有时含部分软装）的整包模式；『全案基础价』常不含管理费，签约前要问清。", "source": "seed", "confidence": 1 },
  { "slug": "ke-li-ban", "name": "颗粒板", "aliases": ["实木颗粒板", "刨花板"], "short_def": "木屑颗粒热压板材，定制柜常用基材，性价比高；环保等级看甲醛释放（ENF/E0/E1）。", "source": "seed", "confidence": 1 },
  { "slug": "shi-mu-xin", "name": "实木芯", "aliases": ["实木多层", "多层实木板"], "short_def": "多层实木单板交错热压的板材，握钉力与防潮优于颗粒板，价格略高（本案 15㎡ 内 +3000）。", "source": "seed", "confidence": 1 },
  { "slug": "ti-jiao-xian", "name": "踢脚线", "aliases": ["踢脚板", "地脚线"], "short_def": "墙面与地面交界处的收边条，保护墙根、遮盖伸缩缝；材质常与地面或门套呼应。", "source": "seed", "confidence": 1 },
  { "slug": "ni-zi", "name": "腻子", "aliases": ["腻子基层", "批腻子"], "short_def": "刷漆前找平墙面的基层材料，耐水腻子更耐潮；基层质量决定乳胶漆最终效果。", "source": "seed", "confidence": 1 },
  { "slug": "ru-jiao-qi", "name": "乳胶漆", "aliases": ["墙面漆", "内墙涂料"], "short_def": "水性内墙涂料，环保性看 VOC 与净味认证；通常一底两面三道工序。", "source": "seed", "confidence": 1 },
  { "slug": "fang-shui", "name": "专业防水", "aliases": ["防水涂料", "防水工程"], "short_def": "卫生间/阳台等湿区涂刷防水涂层并闭水试验，属隐蔽工程；返工代价极高，材料与工艺都关键。", "source": "seed", "confidence": 1 },
  { "slug": "ji-cheng-diao-ding", "name": "集成吊顶", "aliases": ["铝扣板吊顶"], "short_def": "铝扣板模块+电器（浴霸/照明/换气）一体化吊顶，常用于厨卫，检修方便。", "source": "seed", "confidence": 1 },
  { "slug": "di-lou", "name": "地漏", "aliases": ["防臭地漏"], "short_def": "地面排水口，核心是防臭防返溢；深水封或磁悬浮芯体验差异明显。", "source": "seed", "confidence": 1 },
  { "slug": "ppr-gei-shui-guan", "name": "PPR给水管", "aliases": ["PPR管", "给水管"], "short_def": "热熔连接的冷热水管材，隐蔽工程主角之一；管材与热熔工艺决定漏水风险。", "source": "seed", "confidence": 1 },
  { "slug": "lin-yu-fang", "name": "淋浴房", "aliases": ["淋浴隔断", "玻璃淋浴房"], "short_def": "钢化玻璃干湿分离隔断；是否包含在套餐内、面积上限（如约≤3.6㎡）是常见增项点。", "source": "seed", "confidence": 1 },
  { "slug": "quan-wu-ding-zhi", "name": "全屋定制", "aliases": ["定制柜", "定制家具"], "short_def": "按户型定制的柜体（衣柜/橱柜/收纳），套餐常含固定投影面积（如 15㎡），超出按增项计。", "source": "seed", "confidence": 1 },
  { "slug": "gong-cheng-guan-li-fei", "name": "工程管理费", "aliases": ["管理费"], "short_def": "装修公司收取的施工管理费用，常按硬装造价百分比（如 12%）计，注意计费基数。", "source": "seed", "confidence": 1 },
  { "slug": "xiang-mu-jing-li-fei", "name": "项目经理费", "aliases": ["项目管理费"], "short_def": "支付给驻场项目经理的费用（如硬装 2%），有的公司并入管理费，签约前确认口径。", "source": "seed", "confidence": 1 },
  { "slug": "yi-fang-yi-jia", "name": "一房一价", "aliases": ["一房一价表"], "short_def": "按面积档位列出的套餐总价查询表，通常含定制、不含管理费；核对自家计价面积落在哪一档。", "source": "seed", "confidence": 1 },
  { "slug": "chuang-tai-shi", "name": "窗台石", "aliases": ["窗台板"], "short_def": "窗台台面石材，天然石/人造石/岩板均可；防水防晒且好打理是选材重点。", "source": "seed", "confidence": 1 },
  { "slug": "xian-guan-di-he", "name": "线管底盒", "aliases": ["穿线管", "接线底盒"], "short_def": "电线穿管保护与开关插座预埋盒，属隐蔽工程辅材；阻燃等级与壁厚是质量关键。", "source": "seed", "confidence": 1 },
  { "slug": "fu-cai", "name": "辅材", "aliases": ["辅料"], "short_def": "水泥沙浆、管线、腻子、防水等不直接可见的基础材料；套餐差异常藏在辅材品牌里。", "source": "seed", "confidence": 1 },
  { "slug": "zhu-cai", "name": "主材", "aliases": ["主材包"], "short_def": "可见的成品材料：瓷砖、地板、门、洁具、橱柜等；套餐一般给品牌池供选择。", "source": "seed", "confidence": 1 },
  { "slug": "chai-gai", "name": "拆改", "aliases": ["拆除改造", "砸墙"], "short_def": "拆除原有墙体/地面/设施的工程，套餐通常不含、按实结算，是常见的价外支出。", "source": "seed", "confidence": 1 },
  { "slug": "cheng-pin-bao-hu", "name": "成品保护", "aliases": ["成品保护膜"], "short_def": "施工期间对已完成部位（地面、门窗、柜体）覆膜防护，避免交叉污染与磕碰。", "source": "seed", "confidence": 1 },
  { "slug": "jun-gong-bao-jie", "name": "竣工保洁", "aliases": ["开荒保洁"], "short_def": "工程收尾后的全面清洁（除胶、除尘、玻璃），套餐是否包含要看合同明细。", "source": "seed", "confidence": 1 },
  { "slug": "yin-bi-gong-cheng", "name": "隐蔽工程", "aliases": ["水电隐蔽"], "short_def": "完工后被覆盖看不见的工程（水电、防水、结构加固），质保期通常更长（如约 5 年）。", "source": "seed", "confidence": 1 },
  { "slug": "zeng-xiang", "name": "增项", "aliases": ["加项", "增项费用"], "short_def": "套餐范围之外另行收费的项目（拆改、超量定制、特殊工艺等）；控制增项是控预算核心。", "source": "seed", "confidence": 1 }
]
